{
  "type": "stat_card",
  "label": "งบที่ใช้ไปรวม",
  "value": 4993614,
  "format": "currency",
  "icon": "📊",
  "status": "good",
  "trend": {
    "direction": "up",
    "value": 92.0,
    "label": "ของงบต้นปี"
  },
  "meta": {
    "source_query": "SELECT SUM(actual) FROM projects WHERE fiscal_year = 2569",
    "generated_at": "2026-08-25T00:00:00+07:00"
  }
}
